{
  "tool_name": "container-security-baseline",
  "tool_version": "1.0.0",
  "schema_version": "1.0.0",
  "generated_at_utc": "2026-08-06T12:04:50Z",
  "synthetic": true,
  "input_summary": {
    "project_root": ".",
    "compose_files": [
      "examples/compose/insecure-compose.yml"
    ],
    "dockerfile_files": [
      "examples/dockerfiles/Dockerfile.insecure"
    ],
    "compose_json_files": [],
    "privacy_mode": "masked",
    "policy_name": "baseline"
  },
  "policy": {
    "name": "baseline",
    "fail_on": "High",
    "minimum_score": 0
  },
  "privacy_mode": "masked",
  "parsing_status": "ok",
  "files_analyzed": [
    "examples/compose/insecure-compose.yml",
    "examples/dockerfiles/Dockerfile.insecure"
  ],
  "compose_services": [
    "synthetic-api",
    "synthetic-web"
  ],
  "dockerfile_stages": [],
  "result_counts": {
    "Fail": 65,
    "NotApplicable": 6
  },
  "severity_counts": {
    "Critical": 12,
    "High": 14,
    "Informational": 6,
    "Low": 20,
    "Medium": 13
  },
  "category_counts": {
    "Build context": 1,
    "Capabilities": 8,
    "Filesystem": 11,
    "Host access": 4,
    "Identity": 3,
    "Image provenance": 6,
    "Isolation": 2,
    "Logging": 3,
    "Networking": 3,
    "Privilege": 2,
    "Process model": 2,
    "Reliability": 4,
    "Resources": 6,
    "Secrets": 8,
    "Supply chain": 2
  },
  "score": 0,
  "grade": "F",
  "score_explanation": "Started at 100. Applied 59 finding-based deduction(s). Suppressed findings do not reduce the score. Grade F is a prioritization aid, not certification.",
  "highest_severity": "Critical",
  "findings": [
    {
      "rule_id": "CSB-CMP-001",
      "title": "privileged mode enabled",
      "target_type": "compose",
      "category": "Privilege",
      "severity": "Critical",
      "status": "Fail",
      "summary": "Service sets privileged: true.",
      "risk": "Privileged mode significantly weakens container isolation and grants broad host access.",
      "evidence_redacted": "services.synthetic-web.privileged=true",
      "remediation": "Set privileged: false or remove the field.",
      "detailed_remediation": "Set privileged: false or remove the field.",
      "references": [
        "https://docs.docker.com/engine/security/",
        "https://docs.docker.com/compose/compose-file/"
      ],
      "file": "examples/compose/insecure-compose.yml",
      "line_start": null,
      "line_end": null,
      "service": "synthetic-web",
      "stage": null,
      "property_path": "services.synthetic-web.privileged",
      "fingerprint": "f03134df76c14c2c",
      "suppressed": false,
      "suppression_id": null,
      "suppression_justification": null,
      "evaluated_at_utc": "2026-08-06T12:04:50Z",
      "evaluator_version": "1.0.0",
      "error_message": null,
      "patchability": "safe",
      "confidence": "high"
    },
    {
      "rule_id": "CSB-CMP-001",
      "title": "privileged mode enabled",
      "target_type": "compose",
      "category": "Privilege",
      "severity": "Critical",
      "status": "Fail",
      "summary": "Service sets privileged: true.",
      "risk": "Privileged mode significantly weakens container isolation and grants broad host access.",
      "evidence_redacted": "services.synthetic-api.privileged=true",
      "remediation": "Set privileged: false or remove the field.",
      "detailed_remediation": "Set privileged: false or remove the field.",
      "references": [
        "https://docs.docker.com/engine/security/",
        "https://docs.docker.com/compose/compose-file/"
      ],
      "file": "examples/compose/insecure-compose.yml",
      "line_start": null,
      "line_end": null,
      "service": "synthetic-api",
      "stage": null,
      "property_path": "services.synthetic-api.privileged",
      "fingerprint": "7a071c5062006830",
      "suppressed": false,
      "suppression_id": null,
      "suppression_justification": null,
      "evaluated_at_utc": "2026-08-06T12:04:50Z",
      "evaluator_version": "1.0.0",
      "error_message": null,
      "patchability": "safe",
      "confidence": "high"
    },
    {
      "rule_id": "CSB-CMP-002",
      "title": "Docker/runtime socket mounted",
      "target_type": "compose",
      "category": "Host access",
      "severity": "Critical",
      "status": "Fail",
      "summary": "A Docker/Podman runtime socket appears to be bind-mounted.",
      "risk": "Mounting the runtime socket often equates to root-equivalent host control.",
      "evidence_redacted": "services.synthetic-web mounts a path matching a runtime socket pattern",
      "remediation": "Do not mount docker.sock/podman.sock; use least-privilege APIs or socket proxies if required.",
      "detailed_remediation": "Do not mount docker.sock/podman.sock; use least-privilege APIs or socket proxies if required.",
      "references": [
        "https://docs.docker.com/engine/security/",
        "https://docs.docker.com/compose/compose-file/"
      ],
      "file": "examples/compose/insecure-compose.yml",
      "line_start": null,
      "line_end": null,
      "service": "synthetic-web",
      "stage": null,
      "property_path": "services.synthetic-web.volumes",
      "fingerprint": "dc042435e588df74",
      "suppressed": false,
      "suppression_id": null,
      "suppression_justification": null,
      "evaluated_at_utc": "2026-08-06T12:04:50Z",
      "evaluator_version": "1.0.0",
      "error_message": null,
      "patchability": "manual",
      "confidence": "high"
    },
    {
      "rule_id": "CSB-CMP-002",
      "title": "Docker/runtime socket mounted",
      "target_type": "compose",
      "category": "Host access",
      "severity": "Critical",
      "status": "Fail",
      "summary": "A Docker/Podman runtime socket appears to be bind-mounted.",
      "risk": "Mounting the runtime socket often equates to root-equivalent host control.",
      "evidence_redacted": "services.synthetic-api mounts a path matching a runtime socket pattern",
      "remediation": "Do not mount docker.sock/podman.sock; use least-privilege APIs or socket proxies if required.",
      "detailed_remediation": "Do not mount docker.sock/podman.sock; use least-privilege APIs or socket proxies if required.",
      "references": [
        "https://docs.docker.com/engine/security/",
        "https://docs.docker.com/compose/compose-file/"
      ],
      "file": "examples/compose/insecure-compose.yml",
      "line_start": null,
      "line_end": null,
      "service": "synthetic-api",
      "stage": null,
      "property_path": "services.synthetic-api.volumes",
      "fingerprint": "203784fee6e3e95a",
      "suppressed": false,
      "suppression_id": null,
      "suppression_justification": null,
      "evaluated_at_utc": "2026-08-06T12:04:50Z",
      "evaluator_version": "1.0.0",
      "error_message": null,
      "patchability": "manual",
      "confidence": "high"
    },
    {
      "rule_id": "CSB-CMP-004",
      "title": "Sensitive host path mounted read-write",
      "target_type": "compose",
      "category": "Host access",
      "severity": "High",
      "status": "Fail",
      "summary": "Sensitive host path mounted read-write.",
      "risk": "Writable sensitive mounts can expose or alter host credentials and configuration.",
      "evidence_redacted": "services.synthetic-web mounts sensitive path read-write (target=/var/run/docker.sock)",
      "remediation": "Prefer read-only mounts or remove the mount; use named volumes for app data.",
      "detailed_remediation": "Prefer read-only mounts or remove the mount; use named volumes for app data.",
      "references": [
        "https://docs.docker.com/engine/security/",
        "https://docs.docker.com/compose/compose-file/"
      ],
      "file": "examples/compose/insecure-compose.yml",
      "line_start": null,
      "line_end": null,
      "service": "synthetic-web",
      "stage": null,
      "property_path": "services.synthetic-web.volumes",
      "fingerprint": "a31b9c55820c5baa",
      "suppressed": false,
      "suppression_id": null,
      "suppression_justification": null,
      "evaluated_at_utc": "2026-08-06T12:04:50Z",
      "evaluator_version": "1.0.0",
      "error_message": null,
      "patchability": "safe",
      "confidence": "high"
    },
    {
      "rule_id": "CSB-CMP-004",
      "title": "Sensitive host path mounted read-write",
      "target_type": "compose",
      "category": "Host access",
      "severity": "High",
      "status": "Fail",
      "summary": "Sensitive host path mounted read-write.",
      "risk": "Writable sensitive mounts can expose or alter host credentials and configuration.",
      "evidence_redacted": "services.synthetic-api mounts sensitive path read-write (target=/var/run/docker.sock)",
      "remediation": "Prefer read-only mounts or remove the mount; use named volumes for app data.",
      "detailed_remediation": "Prefer read-only mounts or remove the mount; use named volumes for app data.",
      "references": [
        "https://docs.docker.com/engine/security/",
        "https://docs.docker.com/compose/compose-file/"
      ],
      "file": "examples/compose/insecure-compose.yml",
      "line_start": null,
      "line_end": null,
      "service": "synthetic-api",
      "stage": null,
      "property_path": "services.synthetic-api.volumes",
      "fingerprint": "b17c1f21ad383256",
      "suppressed": false,
      "suppression_id": null,
      "suppression_justification": null,
      "evaluated_at_utc": "2026-08-06T12:04:50Z",
      "evaluator_version": "1.0.0",
      "error_message": null,
      "patchability": "safe",
      "confidence": "high"
    },
    {
      "rule_id": "CSB-CMP-006",
      "title": "network_mode host",
      "target_type": "compose",
      "category": "Isolation",
      "severity": "High",
      "status": "Fail",
      "summary": "Service uses network_mode: host.",
      "risk": "Host networking removes network namespace isolation.",